<?xml version="1.0" encoding="ISO-8859-1"?><!--
    Copyright (c) 2004, 2010 BREDEX GmbH.
    All rights reserved. This program and the accompanying materials
    are made available under the terms of the Eclipse Public License v1.0
    which accompanies this distribution, and is available at
    http://www.eclipse.org/legal/epl-v10.html
 -->

<!--CAUTION: don?t format any entries, especially don?t use line breaks!
	The value of the formated item may contain formating characters like
	tabs or newlines, making them unusable for class or data lookup!-->
<compSystem xmlns:xsi="http://www.w3.org/2001/XMLSchema-instance"
	xsi:noNamespaceSchemaLocation="ToolkitComponentConfiguration.xsd">
	<configVersion>
		<majorVersion>1</majorVersion>
		<minorVersion>38</minorVersion>
		<majorCustomVersion>0</majorCustomVersion>
		<minorCustomVersion>0</minorCustomVersion>
	</configVersion>

	<toolkitComponent type="org.eclipse.swt.widgets.Group" visible="true">
		<realizes>guidancer.abstract.Widget</realizes>
		<testerClass>org.eclipse.jubula.rc.swt.implclasses.GroupImplClass</testerClass>
		<componentClass name="org.eclipse.swt.widgets.Group" />
	</toolkitComponent>

</compSystem>